title,price
Rosette Long Sleeve Top in Melt,"Rs. 13,600.00"
Sheer Turtleneck Sweater,"Rs. 14,500.00"
Tierney Boucle Coatigan With Scarf,"Rs. 14,600.00"
Drapey Knit Sweatshirt in Interlock,"Rs. 14,500.00"
Drapey Knit Sweatshirt in Interlock,"Rs. 14,500.00"
Alison Pullover,"Rs. 44,800.00"
Mimi Long Sleeve Knit Sweater,"Rs. 26,400.00"
Vivienne Ski Pully,"Rs. 26,400.00"
Vail Boo Sweater,"Rs. 26,500.00"
Off Shoulder Sweatshirt in French Terry,"Rs. 13,600.00"
Keystone Blanche Half Zip,"Rs. 17,400.00"
aSMC Reg Sweatshirt,"Rs. 11,000.00"
Metallic Slouchy Sweater,"Rs. 15,400.00"
Martini Embellished Sweatshirt,"Rs. 14,500.00"
Ophelia Lurex Johnny Collar Top,"Rs. 9,100.00"
Golden Mesh Tee Shirt,"Rs. 9,000.00"
Perfect Jacquard 1/4 Zip Baselayer,"Rs. 22,900.00"
Rocky Ridge Pullover,"Rs. 15,400.00"
Liquid Metallic Bodysuit,"Rs. 12,600.00"
Liquid Metallic Long Sleeve Top,"Rs. 11,700.00"
Silver Mesh Long Sleeve Top,"Rs. 10,800.00"
Pearl Necklace Sweater Tank,"Rs. 13,600.00"
Off Shoulder Sweatshirt in French Terry,"Rs. 13,600.00"
Mock Neck Corset Zip Top in Melt,"Rs. 13,600.00"
Pearl Sweatshirt,"Rs. 14,500.00"
Wool Blend Slouchy Knit Sweater,"Rs. 15,400.00"
Pearl Necklace Sweater Tank,"Rs. 13,600.00"
Peplum Zip Up,"Rs. 16,300.00"
Crop Tee,"Rs. 10,500.00"
Sweater Shrug,"Rs. 13,600.00"
Nomai Sheer Sleeve Mock Neck Sweater,"Rs. 26,100.00"
Cross Over Sweater,"Rs. 14,500.00"
Wool Blend Slouchy Knit Sweater,"Rs. 15,400.00"
Cross Over Sweater,"Rs. 14,500.00"
Mock Neck Corset Zip Top in Melt,"Rs. 13,600.00"
Serena Top,"Rs. 13,300.00"
Timberley Half Zip Midlayer,"Rs. 11,700.00"
Willard Half Zip Knit 2.0,"Rs. 16,300.00"
Castilla Clara Knit Crew,"Rs. 17,400.00"
Off Shoulder Sweatshirt in French Terry,"Rs. 13,600.00"
Golden Mesh Tee Shirt,"Rs. 9,000.00"
Club38 Sweater Vest,"Rs. 12,600.00"
Oversized Raglan Sleeve Top W/ Tube Scarf,"Rs. 29,300.00"
NK Sleeve Drop Shoulder Side Drape Top,"Rs. 10,100.00"
Asymmetrical Sweater Top,"Rs. 12,600.00"
Pullover Sweatshirt,"Rs. 11,700.00"
Short Sleeve Off Shoulder Sweatshirt in French Terry,"Rs. 12,600.00"
aSMC CRO Hoodie,"Rs. 11,000.00"
Mock Neck Corset Zip Top in Melt,"Rs. 13,600.00"
Sheer Spliced Mock Neck in Melt,"Rs. 11,700.00"
Collared High Low Tunic,"Rs. 11,700.00"
Tuxedo Mock Neck Top,"Rs. 10,800.00"
Long Sleeve Tie Top in Melt,"Rs. 11,900.00"
Cross Over Sweater,"Rs. 14,500.00"
Wool Blend Slouchy Knit Sweater,"Rs. 15,400.00"
Priya Sweat,"Rs. 14,500.00"
Half Zip Boucle Pullover,"Rs. 17,200.00"
Tuxedo Mock Neck Top,"Rs. 10,800.00"
Raleigh Zip Through Sweat,"Rs. 15,400.00"
Mock Neck Corset Zip Top in Melt,"Rs. 13,600.00"
Striped Puff Sleeve Sweater,"Rs. 16,300.00"
Off Shoulder Sweatshirt in French Terry,"Rs. 13,600.00"
Half Zip Boucle Pullover,"Rs. 17,200.00"
Reversible Boucle Sweater,"Rs. 15,400.00"
Milano Half Zip Sweat,"Rs. 11,700.00"
Maxwork Cable Pullover,"Rs. 20,900.00"
Ailsa Zip Through Midlayer,"Rs. 13,600.00"
Wool Blend Slouchy Knit Sweater,"Rs. 15,400.00"
Striped Puff Sleeve Sweater,"Rs. 16,300.00"
Off Shoulder Sweatshirt in French Terry,"Rs. 13,600.00"
Asymmetrical Sweater Top,"Rs. 12,600.00"
Eleanor Patch Pocket Fleece,"Rs. 17,200.00"
Long Sleeve Tie Top in Melt,"Rs. 12,600.00"
Half Zip Asymmetrical Pullover in Interlock,"Rs. 13,600.00"
Pullover Sweatshirt,"Rs. 11,700.00"
Fringe Tank in Melt,"Rs. 11,700.00"
Pleated Running Tank,"Rs. 9,900.00"
Crochet Off Shoulder Sweater,"Rs. 27,400.00"
aSMC TruePace Running Crop,"Rs. 6,400.00"
Varsity Cable Knit Cardigan,"Rs. 14,500.00"
Short Sleeve Off Shoulder Sweatshirt in French Terry,"Rs. 12,600.00"
Wool Blend Slouchy Knit Sweater,"Rs. 15,400.00"
Strappy Tank in Melt,"Rs. 9,900.00"
Long Sleeve Tie Top in Melt,"Rs. 12,600.00"
Colorblock High Neck Tank,"Rs. 9,900.00"
Off Shoulder Sweatshirt in French Terry,"Rs. 13,600.00"
Mixed Media Rugby Collared Sweater,"Rs. 14,500.00"
Long Sleeve Tie Top in Melt,"Rs. 12,600.00"
Colorblock High Neck Tank,"Rs. 9,900.00"
Wide Scoop Bra Tank in Melt,"Rs. 9,000.00"
Pullover Sweatshirt,"Rs. 11,700.00"
Long Sleeve Off Shoulder Tee,"Rs. 8,100.00"
Racer Tailored Terry Tank Top,"Rs. 11,500.00"
Pullover Sweatshirt,"Rs. 11,700.00"
Slouchy Knit Sweater,"Rs. 14,500.00"
Fringe Mock Neck in Melt,"Rs. 12,600.00"
